title,author,price,pages,avg_reviews,n_reviews,dimensions,weight,language
Becoming a Data Head: How to Think Speak and Understand Data Science Statistics and Machine Learning,"[Alex J. Gutman,Jordan Goldmeier]",24.49,272,4.6,184,6 x 0.62 x 9 inches,12.5 ounces,English
Ace the Data Science Interview: 201 Real Interview Questions Asked FAANG Tech Startups & Wall Street,"[Nick Singh,Kevin Huo]",26,301,4.5,599,7 x 0.68 x 10 inches,1.28 pounds,English
Fundamentals of Data Engineering: Plan and Build Robust Data Systems,"[Joe Reis,Matt Housley]",50.76,446,5,33,7 x 1 x 9.25 inches,1.57 pounds,English
Essential Math for Data Science: Take Control of Your Data with Fundamental Linear Algebra Probability and Statistics,[Thomas Nield],44.8,347,4.5,27,7 x 0.75 x 9 inches,1.23 pounds,English
Data Science for Business: What You Need to Know about Data Mining and Data-Analytic Thinking,"[Foster Provost,Tom Fawcett]",36.99,413,4.5,970,7 x 0.9 x 9.19 inches,1.5 pounds,English
Data Science from Scratch: First Principles with Python,[Joel Grus],45.22,406,4.4,594,6.9 x 0.9 x 9.1 inches,1.4 pounds,English
Practical Statistics for Data Scientists: 50+ Essential Concepts Using R and Python,"[Peter Bruce,Andrew Bruce et al.]",24.88,368,4.6,655,7 x 0.9 x 9.1 inches,1.3 pounds,English
Python for Data Science: A Hands-On Introduction,[Yuli Vasiliev],28.49,240,4.3,6,7 x 0.71 x 9.25 inches,13 ounces,English
Practical Linear Algebra for Data Science: From Core Concepts to Applications Using Python,[Mike Cohen],69.99,328,,0,7 x 0.69 x 9.19 inches,1.15 pounds,English
Data Science (The MIT Press Essential Knowledge series),,9.61,280,4.5,383,5 x 0.57 x 6.9 inches,8.8 ounces,English
Data Science For Dummies (For Dummies (Computer/Tech)),[Lillian Pierson],25.49,432,4.6,35,7.3 x 1 x 9.1 inches,1.35 pounds,English
Azure Data Engineer Associate Certification Guide: A hands-on reference guide to developing your data engineering skills and preparing for the DP-203 exam,[Newton Alex],49.99,574,4.1,16,7.5 x 1.3 x 9.25 inches,2.15 pounds,English
Data Pipelines with Apache Airflow,"[Bas P. Harenslak,Julian Rutger de Ruiter]",47.62,480,4.7,44,7.38 x 1.4 x 9.25 inches,1.9 pounds,English
Practical Data Science with Python: Learn tools and techniques from hands-on examples to extract insights from data,[Nathan George],51.99,620,4.7,21,7.5 x 1.4 x 9.25 inches,2.31 pounds,English
Data Science on AWS: Implementing End-to-End Continuous AI and Machine Learning Pipelines,"[Chris Fregly,Antje Barth]",31.99,521,4.4,135,7 x 1.05 x 9.19 inches,1.82 pounds,English
Data Analysis for Business Economics and Policy,"[Gábor Békés,Gábor Kézdi]",61.74,738,4.4,26,7.5 x 1.74 x 9.25 inches,3.51 pounds,English
Machine Learning Design Interview: Machine Learning System Design Interview,[Khang Pham],34.15,210,3.6,57,6 x 0.48 x 9 inches,11.8 ounces,English
Hands-On Data Analysis with Pandas: A Python data science handbook for data collection wrangling analysis and visualization 2nd Edition,"[Stefanie Molin,Ken Jee]",35.67,788,4.3,64,7.5 x 1.78 x 9.25 inches,2.93 pounds,English
Business Data Science: Combining Machine Learning and Economics to Optimize Automate and Accelerate Business Decisions,[Matt Taddy],33.43,352,4.5,143,1.19 x 7.38 x 9.25 inches,1.62 pounds,English
The Art of Statistics: How to Learn from Data,[David Spiegelhalter],17.99,448,4.6,2764,5.4 x 1.3 x 8.2 inches,13.6 ounces,English
Cleaning Data for Effective Data Science: Doing the other 80% of the work with Python R and command-line tools,[David Mertz],39.99,498,4.8,27,7.5 x 1.13 x 9.25 inches,1.85 pounds,English
Everything Data Analytics-A Beginners Guide to Data Literacy: Understanding the Processes That Turn Data Into Insights (Guides for Data Analytics Data Visualization and Communicating Data),,14.49,148,4.2,17,5.5 x 0.37 x 8.5 inches,8.8 ounces,English
Effective Data Science Infrastructure: How to make data scientists productive,[Ville Tuulos],49.99,352,5,5,7.38 x 0.8 x 9.25 inches,1.15 pounds,English
Python Data Science Handbook: Essential Tools for Working with Data,[Jake VanderPlas],66.49,550,,0,,1.11 pounds,English
The Enterprise Big Data Lake: Delivering the Promise of Big Data and Data Science,[Alex Gorelik],40.1,224,4.3,71,7 x 0.4 x 9.1 inches,11.2 ounces,English
Data-Driven Science and Engineering: Machine Learning Dynamical Systems and Control,"[Steven L. Brunton,J. Nathan Kutz]",58.49,614,4.6,14,7.1 x 1.1 x 10.1 inches,3.1 pounds,English
Hands-On Data Science for Marketing: Improve your marketing strategies with machine learning using Python and R,[Yoon Hyup Hwang],44.99,464,4.3,63,7.5 x 1.05 x 9.25 inches,1.74 pounds,English
Be Data Driven: How Organizations Can Harness the Power of Data,[Jordan Morrow],34.99,240,5,1,6.14 x 0.55 x 9.21 inches,12 ounces,English
Data Science Projects with Python: A case study approach to gaining valuable insights from real data with machine learning 2nd Edition,[Stephen Klosterman],36.99,432,4.6,52,7.5 x 0.98 x 9.25 inches,1.63 pounds,English
The Kaggle Book: Data analysis and machine learning for competitive data science,"[Konrad Banachewicz,Luca Massaron et al.]",39.94,530,4.6,68,7.5 x 1.2 x 9.25 inches,1.98 pounds,English
Think Like a Data Scientist: Tackle the data science process step--step,[Brian Godsey],29.59,328,4.5,31,7.38 x 0.7 x 9.25 inches,1.47 pounds,English
Designing Data-Intensive Applications: The Big Ideas Behind Reliable Scalable and Maintainable Systems,[Martin Kleppmann],23.37,611,4.8,3167,7.01 x 1.24 x 9.17 inches,2.15 pounds,English
Data Smart: Using Data Science to Transform Information into Insight,[John W. Foreman],21.1,432,4.5,346,7.3 x 0.8 x 9.1 inches,1.6 pounds,English
Python for Data Analysis: Data Wrangling with pandas NumPy and Jupyter,[Wes McKinney],62.99,579,5,1,9.1 x 1.2 x 6.9 inches,2.07 pounds,English
Modern Data Science with R (Chapman & Hall/CRC Texts in Statistical Science),,72.59,632,3.9,9,7.25 x 1.5 x 10.25 inches,3.31 pounds,English
Machine Learning: 4 Books in 1: The #1 Beginners Guide to Master the Basics of Python Programming Learn the Art of Data Science and Build Artificial Intelligence,[Andrew Park],25.97,342,4.6,344,6 x 0.78 x 9 inches,1.29 pounds,English
Building Big Data Pipelines with Apache Beam: Use a single programming model for both batch and stream data processing,[Jan Lukavsky],46.99,342,3.9,11,7.5 x 0.78 x 9.25 inches,1.3 pounds,English
Algorithmic Finance: A Companion To Data Science,[Christopher Hian-ann Ting],116.85,408,,0,6 x 1.15 x 9 inches,1.58 pounds,English
Naked Statistics: Stripping the Dread from the Data,,11.69,304,4.6,2271,5.5 x 0.8 x 8.2 inches,7.1 ounces,English
Bayesian Ideas and Data Analysis: An Introduction for Scientists and Statisticians (Chapman & Hall/CRC Texts in Statistical Science),,64.1,516,4,14,6.9 x 1.1 x 10 inches,2.35 pounds,English
Julia Data Science,"[Jose Storopoli,Rik Huijzer et al.]",31.99,170,4.5,9,7 x 0.4 x 10 inches,13.9 ounces,English
Listening to People: A Practical Guide to Interviewing Participant Observation Data Analysis and Writing It All Up (Chicago Guides to Writing Editing and Publishing),,19,333,4.5,33,6 x 0.9 x 9 inches,1.01 pounds,English
Doing Data Science: Straight Talk from the Frontline,"[""Cathy ONeil"",Rachel Schutt]",26.3,408,4.3,172,6 x 0.78 x 9 inches,1.2 pounds,English
Microsoft Power BI Quick Start Guide: Bring your data to life through data modeling visualization digital storytelling and more 2nd Edition,"[Devin Knight,Mitchell Pearson et al.]",28.49,294,4.3,142,7.5 x 0.67 x 9.25 inches,1.12 pounds,English
R in Action Third Edition: Data analysis and graphics with R and Tidyverse,[Robert I. Kabacoff],56.99,656,4.6,8,7.38 x 1.5 x 9.25 inches,2.15 pounds,English
Data Science Ethics: Concepts Techniques and Cautionary Tales,[David Martens],37.2,272,5,2,9.4 x 0.6 x 6.2 inches,15.5 ounces,English
Data Science and Machine Learning: Mathematical and Statistical Methods (Chapman & Hall/CRC Machine Learning & Pattern Recognition),,77.43,510,4.8,37,8.9 x 1.2 x 11 inches,3.73 pounds,English
Data Mesh in Action,"[Jacek Majchrzak,Sven Balnojan et al.]",69.99,300,,0,7.38 x 0.75 x 9.25 inches,12.6 ounces,English
The Machine Learning Solutions Architect Handbook: Create machine learning platforms to run solutions in an enterprise setting,[David Ping],43.97,442,4.7,39,7.5 x 1 x 9.25 inches,1.66 pounds,English
Practical Big Data Analytics: Hands-on techniques to implement enterprise analytics and machine learning using Hadoop Spark NoSQL and R,[Nataraj Dasgupta],44.99,412,3.8,7,7.5 x 0.93 x 9.25 inches,1.55 pounds,English
Simplify Big Data Analytics with Amazon EMR: A beginners guide to learning and implementing Amazon EMR for building data analytics solutions,[Sakti Mishra],46.99,430,5,9,7.5 x 0.97 x 9.25 inches,1.62 pounds,English
Bootstrap:Data Science Workbook,"[Emmanuel Schanzer,Kathi Fisler et al.]",4.73,148,,0,8.5 x 0.34 x 10.98 inches,9.6 ounces,English
Amazon Redshift Cookbook: Recipes for building modern data warehousing solutions,"[Shruti Worlikar,Thiyagarajan Arumugam et al.]",51.99,384,4.5,23,7.5 x 0.87 x 9.25 inches,1.45 pounds,English
SQL for Data Analytics: Harness the power of SQL to extract insights from data 3rd Edition,"[Jun Shan,Matt Goldwasser et al.]",44.99,540,5,6,7.5 x 1.22 x 9.25 inches,2.02 pounds,English
Communicating with Data: Making Your Case With Data,[Carl Allchin],40.99,340,5,4,7 x 0.5 x 9.25 inches,1.2 pounds,English
Data Analytics: A Small Data Approach (Chapman & Hall/CRC Data Science Series),,89.95,257,5,2,8.5 x 0.75 x 11 inches,1.48 pounds,English
Data Structures the Fun Way: An Amusing Adventure with Coffee-Filled Examples,[Jeremy Kubica],29.99,304,,0,7 x 0.7 x 9.2 inches,13 ounces,English
Data Analysis with R - Second Edition: A comprehensive guide to manipulating analyzing and visualizing data in R,[Tony Fischetti],38.82,570,4.4,20,7.5 x 1.29 x 9.25 inches,2.13 pounds,English
Data Engineering with AWS: Learn how to design and build cloud-based data transformation pipelines using AWS,[Gareth Eagar],39.99,482,4.4,48,7.5 x 1.09 x 9.25 inches,1.81 pounds,English
Data Science: Advanced Guide to Learn the Realms of Data Science Effectively,[Benjamin Smith],19.99,212,,0,6 x 0.48 x 9 inches,10.2 ounces,English
Data Science for Supply Chain Forecasting,[Nicolas Vandeput],49.39,280,4.6,63,6.69 x 0.65 x 9.61 inches,1.16 pounds,English
Heard In Data Science Interviews: Over 650 Most Commonly Asked Interview Questions & Answers,[Kal Mishra],37.99,240,3.2,52,6 x 0.55 x 9 inches,11.5 ounces,English
DATA ANALYTICS: A Comprehensive Beginner’s Guide To Learn About The Realms Of Data Analytics From A-Z,[Mr Benjamin Smith],19.99,153,4.2,37,6 x 0.35 x 9 inches,7.5 ounces,English
Introduction to Data Science: Data Analysis and Prediction Algorithms with R (Chapman & Hall/CRC Data Science Series),,77.28,713,4.8,34,7 x 1.6 x 10.1 inches,3.67 pounds,English
Introduction to Machine Learning with R: Rigorous Mathematical Analysis,[Scott V. Burger],49.99,226,4.1,21,7 x 0.48 x 9.19 inches,14.3 ounces,English
PYTHON FOR DATA SCIENCE: The Ultimate Beginners’ Guide to Learning Python Data Science Step Step,[Mr Ethan Williams],19.99,199,4.3,68,6 x 0.45 x 9 inches,9.6 ounces,English
97 Things About Ethics Everyone in Data Science Should Know: Collective Wisdom from the Experts,[Bill Franks],30.99,346,4.1,18,6 x 0.72 x 9 inches,1.02 pounds,English
Data Science for Marketing Analytics: A practical guide to forming a killer marketing strategy through data analysis with Python 2nd Edition,"[Mirza Rahim Baig,Gururajan Govindan et al.]",36.99,636,4.6,51,7.5 x 1.44 x 9.25 inches,2.37 pounds,English
Video Data Analysis: How to Use 21st Century Video in the Social Sciences,"[Anne Nassauer,Nicolas M. Legewie]",45,320,5,1,6 x 0.67 x 9 inches,1.13 pounds,English
The Beginners Guide to Data Science,"[Robert Ball,Brian Rague]",69.99,382,,0,,1.74 pounds,English
Hands-On Data Science with R: Techniques to perform data manipulation and mining to build smart analytical models using R,"[Vitor Bianchi Lanzetta,Nataraj Dasgupta et al.]",39.99,420,4.1,5,7.5 x 0.95 x 9.25 inches,1.58 pounds,English
The Data Science Handbook: Advice and Insights from 25 Amazing Data Scientists,"[Carl Shan,William Chen et al.]",24.99,346,4.4,55,6 x 0.78 x 9 inches,12.6 ounces,English
Machine Learning and Data Science Blueprints for Finance: From Building Trading Strategies to Robo-Advisors Using Python,"[Hariom Tatsat,Sahil Puri et al.]",44.49,432,4.3,51,7 x 1 x 9.1 inches,1.45 pounds,English
Practical Python Data Wrangling and Data Quality: Getting Started with Reading Cleaning and Analyzing Data,[Susan McGregor],31.99,,3.5,2,7 x 0.75 x 9.25 inches,1.45 pounds,English
Cracking the Data Science Interview: 101+ Data Science Questions & Solutions,[Maverick Lin],11.99,119,3.7,48,5.5 x 0.3 x 8.5 inches,5.6 ounces,English
SQL for Data Scientists: A Beginners Guide for Building Datasets for Analysis,[Renee M. P. Teate],32.49,288,4.7,54,7.38 x 0.65 x 9.25 inches,1.06 pounds,English
MLOps Engineering at Scale,[Carl Osipov],44.49,344,4.2,3,7.38 x 0.7 x 9.25 inches,1.61 pounds,English
The Data Science Design Manual (Texts in Computer Science),,52.05,462,4.8,63,7.2 x 1.1 x 9.4 inches,22.2 pounds,English
Big Data: A Very Short Introduction (Very Short Introductions),[Dawn E. Holmes],11.07,144,4.4,72,6.8 x 4.5 x 0.5 inches,4.3 ounces,English
SQL for Data Analysis: Advanced Techniques for Transforming Data into Insights,[Cathy Tanimura],40.49,360,4.7,50,6.75 x 0.75 x 8.75 inches,1.2 pounds,English
The Cyberwarrior Handbook: A Beginners Guide to Hacking from Recon to Exploitation,[OccupyTheWeb],49.99,352,,0,,13 ounces,English
Comet for Data Science: Enhance your ability to manage and optimize the life cycle of your data science project,"[Angelica Lo Duca,Gideon Mendels]",44.99,402,5,2,7.5 x 0.91 x 9.25 inches,1.52 pounds,English
Optimization for Data Analysis,"[Stephen J. Wright,Benjamin Recht]",38.91,238,5,2,6.25 x 0.75 x 9.25 inches,1.07 pounds,English
The Self-Taught Computer Scientist: The Beginners Guide to Data Structures & Algorithms,[Cory Althoff],19.49,224,4.5,87,7.38 x 0.51 x 9.25 inches,13.6 ounces,English
Quantitative Social Science: An Introduction in tidyverse,"[Kosuke Imai,Nora Webb Williams]",49.99,488,3.8,3,6.75 x 1 x 9.75 inches,1.92 pounds,English
Data Science Interview: Prep for SQL Panda Python R Language Machine Learning DBMS and RDBMS – And More – The Full Data Scientist Interview Handbook,[DSI ACE PREP],24.99,156,4.7,44,6 x 0.39 x 9 inches,7.1 ounces,English
The Data Vault Guru: a pragmatic guide on building a data vault,[Mr Patrick Cuba],76.96,676,4.1,13,8 x 1.59 x 10 inches,3.43 pounds,English
Responsible Data Science,"[Grant Fleming,Peter C. Bruce]",19.86,304,3.8,8,7.38 x 0.69 x 9.25 inches,1.12 pounds,English
Fundamentals of Data Science with MATLAB: Introduction to Scientific Computing Data Analysis and Data Visualization,[Arash Karimpour],26,424,4.5,4,7.5 x 0.96 x 9.25 inches,1.99 pounds,English
Python for Data Science: Clear and Complete Guide to Data Science and Analysis with Python,[Alex Campbell],14.95,197,3.9,9,6 x 0.45 x 9 inches,10.5 ounces,English
Learn Power BI: A comprehensive step--step guide for beginners to learn real-world business intelligence 2nd Edition,[Greg Deckler],44.64,458,4.4,30,7.5 x 1.04 x 9.25 inches,1.72 pounds,English
Data Visualization with Excel Dashboards and Reports,[Dick Kusleika],22.99,352,4.4,77,7.2 x 0.8 x 9 inches,1.27 pounds,English
Data Science For Dummies 2nd Edition,"[Lillian Pierson,Jake Porway]",41.02,384,4.4,205,7.3 x 1 x 9 inches,1.13 pounds,English
Hands-On Data Structures and Algorithms with Python: Store manipulate and access data effectively and boost the performance of your applications 3rd Edition,[Dr. Basant Agarwal],44.99,496,4.6,5,7.5 x 1.12 x 9.25 inches,1.86 pounds,English
Business Intelligence Analytics and Data Science: A Managerial Perspective,"[Ramesh Sharda,Dursun Delen et al.]",106.66,512,4.5,273,9.8 x 7.8 x 0.7 inches,2.03 pounds,English
Guide to Data Science: Brief Introduction to the Quirky World of Data,[Aryan Goyal],14.99,151,5,1,8.5 x 0.35 x 11 inches,1.02 pounds,English
Machine Learning for Time Series Forecasting with Python,[Francesca Lazzeri],32.49,224,3.9,43,7.38 x 0.51 x 9.25 inches,13.4 ounces,English
Introduction to Computation: Haskell Logic and Automata (Undergraduate Topics in Computer Science),,33.9,382,5,3,8.25 x 0.79 x 11 inches,2.08 pounds,English
Data Science: Concepts and Practice,"[Vijay Kotu,Bala Deshpande]",69.34,568,4.5,9,7.52 x 1.28 x 9.25 inches,2.4 pounds,English
Inferential Network Analysis (Analytical Methods for Social Research),,54.81,314,4.7,7,6 x 0.75 x 8.75 inches,1.04 pounds,English
Data Science In The Library: Tools and Strategies for Supporting Data-Driven Research and Instruction,[Joel Herndon],80.31,224,,0,9.21 x 0.55 x 6.02 inches,9.5 ounces,English
Foundational Python for Data Science (Addison-Wesley Data & Analytics Series),,39.99,256,4.3,7,7 x 0.6 x 9 inches,14.8 ounces,English
Integrating Data,"[Bill Inmon,Patty Haines et al.]",39.95,134,5,1,6 x 0.31 x 9 inches,6.7 ounces,English
Bioinformatics Data Skills: Reproducible and Robust Research with Open Source Tools,[Vince Buffalo],45.77,536,4.6,109,7 x 1.09 x 9.19 inches,1.9 pounds,English
Python Crash Course 2nd Edition: A Hands-On Project-Based Introduction to Programming,[Eric Matthes],21.49,544,4.7,7425,7 x 1.2 x 9.25 inches,2.3 pounds,English
The Esri Guide to GIS Analysis Volume 3: Modeling Suitability Movement and Interaction (The ESRI Guide to GIS Analysis 3),[Andy Mitchell],33.93,420,4.4,27,9.5 x 1 x 7.75 inches,2.15 pounds,English
The Applied SQL Data Analytics Workshop: Develop your practical skills and prepare to become a professional data analyst 2nd Edition,"[Matt Goldwasser,Upom Malik et al.]",34.99,484,4.6,40,7.5 x 1.09 x 9.25 inches,1.67 pounds,English
Data Mesh: Delivering Data-Driven Value at Scale,[Zhamak Dehghani],51.89,384,4.5,101,6.75 x 1 x 9 inches,1.35 pounds,English
End-to-End Data Science with SAS®: A Hands-On Programming Guide,[James Gearheart],39.95,380,4.5,17,7.5 x 0.86 x 9.25 inches,1.44 pounds,English
An Introduction to Data Science,"[Jeffrey S. Saltz,Jeffrey M. Stanton]",44.86,288,4.4,75,7.38 x 0.65 x 9.13 inches,1.1 pounds,English
Probabilistic Machine Learning: An Introduction (Adaptive Computation and Machine Learning series),,99,864,4.4,73,8.25 x 1.44 x 9.29 inches,3.4 pounds,English
Computer Science Unleashed: Harness the Power of Computational Systems,,29.95,268,4.9,25,5.5 x 0.73 x 8.5 inches,3.52 ounces,English
R Statistics Cookbook: Over 100 recipes for performing complex statistical operations with R 3.5,[Francisco Juretig],24.99,448,4.6,22,7.5 x 1.01 x 9.25 inches,1.68 pounds,English
Introduction to Statistics: An Intuitive Guide for Analyzing Data and Unlocking Discoveries,[Jim Frost],18.91,255,4.5,199,6 x 0.58 x 9 inches,12.2 ounces,English
Algorithms and Data Structures for Massive Datasets,"[Dzejla Medjedovic,Emin Tahirovic et al.]",59.99,304,3.8,3,7.38 x 0.8 x 9.25 inches,1.02 pounds,English
Data Science (Chapman & Hall/CRC Data Science Series),"[Tiffany Timbers,Trevor Campbell et al.]",59.95,442,,0,7.01 x 1 x 10 inches,1.86 pounds,English
Data Democratization with Domo: Bring together every component of your business to make better data-driven decisions using Domo,[Jeff Burtenshaw],49.99,576,4.8,6,7.5 x 1.3 x 9.25 inches,2.15 pounds,English
Determann’s Field Guide to Data Privacy Law: International Corporate Compliance (Elgar Compliance Guides),[Lothar Determann],73.08,256,,0,5.75 x 0.5 x 8.75 inches,11.8 ounces,English
Data Visualization with Python for Beginners: Visualize Your Data using Pandas Matplotlib and Seaborn (Machine Learning & Data Science for Beginners),,19.99,288,4.1,61,6 x 0.65 x 9 inches,13.6 ounces,English
Practical Synthetic Data Generation: Balancing Privacy and the Broad Availability of Data,"[Khaled El Emam,Lucy Mosquera et al.]",28.49,166,4.1,14,7 x 0.35 x 9.19 inches,9.6 ounces,English
Data Analysis in Sports Science,"[Gabriel J. Sanders PhD,Corey A. Peacock PhD]",59.99,130,4.7,7,6 x 0.31 x 9 inches,9.6 ounces,English
Python for Geospatial Data Analysis: Theory Tools and Practice for Location Intelligence,[Bonny McClain],66.49,200,,0,,1.11 pounds,English
Data Science for Librarians (Library and Information Science Text Series),,65,168,5,2,7 x 0.41 x 10 inches,13.6 ounces,English
Basketball Data Science: With Applications in R (Chapman & Hall/CRC Data Science Series),,43.35,219,4.1,20,6.25 x 0.5 x 9.5 inches,14.7 ounces,English
Data Analytics for Absolute Beginners: A Deconstructed Guide to Data Literacy: (Introduction to Data Data Visualization Business Intelligence & ... Science Python & Statistics for Beginners),,14.9,153,4.4,309,6 x 0.39 x 9 inches,8.3 ounces,English
Bayesian Data Analysis (Chapman & Hall/CRC Texts in Statistical Science),,78.22,675,4.7,200,7.5 x 1.25 x 10.25 inches,3.05 pounds,English
Murachs Python for Data Analysis (Training & Reference),[Scott Mccoy],58.33,559,4.6,22,7.75 x 1.5 x 9.75 inches,2.8 pounds,English
Cracking the Coding Interview: 189 Programming Questions and Solutions,[Gayle Laakmann McDowell],35.95,687,4.7,7563,7 x 1.59 x 10 inches,2.69 pounds,English
Docker for Data Science: Building Scalable and Extensible Data Infrastructure Around the Jupyter Notebook Server,[Joshua Cook],49.49,278,3.7,10,6.1 x 0.64 x 9.25 inches,9.56 pounds,English
Mastering PostgreSQL 13: Build administer and maintain database applications efficiently with PostgreSQL 13 4th Edition,[Hans-Jurgen Schonig],41.99,476,4.2,35,7.5 x 1.08 x 9.25 inches,1.79 pounds,English
Data Analysis with Python and PySpark,[Jonathan Rioux],48,456,4.8,7,7.38 x 1 x 9.25 inches,1.68 pounds,English
PYTHON: Learn Coding Programs with Python Programming and Master Data Analysis & Analytics Data Science and Machine Learning with the Complete Crash Course for Beginners - 5 Manuscripts in 1 Book,[TechExp Academy],24.9,400,4.2,282,8 x 0.91 x 10 inches,1.9 pounds,English
DATA SCIENCE WITH PYTHON: Complete Guide To Understanding Data Analytics And Data Science With Python Programming (Code tutorials),[Craig Berg],9.98,138,,0,6 x 0.35 x 9 inches,7.5 ounces,English
Data Analytics: Practical Guide to Leveraging the Power of Algorithms Data Science Data Mining Statistics Big Data and Predictive Analysis to Improve Business Work and Life,[Arthur Zhang],11.97,280,3.7,17,6 x 0.64 x 9 inches,1.08 pounds,English
Introduction to Machine Learning,[Etienne Bernard],29.6,424,4.4,11,7 x 0.86 x 10 inches,1.61 pounds,English
Hands-On Data Structures and Algorithms with Kotlin: Level up your programming skills understanding how Kotlins data structure works,"[Chandra Sekhar Nayak,Rivu Chakraborty]",36.99,220,3.6,4,7.5 x 0.5 x 9.25 inches,13.6 ounces,English
Asking Smarter Questions: How To Be an Agent of Insight (Using Data Better),[Sam Knowles],39.95,280,,0,5.06 x 0.64 x 7.81 inches,1.23 pounds,English
Scalable Data Analytics with Azure Data Explorer: Modern ways to query analyze and perform real-time data analysis on large volumes of data,"[Jason Myerscough,Arunee Singhchawla]",51.99,364,5,8,7.5 x 0.82 x 9.25 inches,1.38 pounds,English
The Political Philosophy of AI: An Introduction,[Mark Coeckelbergh],19.59,176,3.7,7,5.4 x 0.7 x 8.5 inches,9.6 ounces,English
Transformers for Machine Learning: A Deep Dive (Chapman & Hall/CRC Machine Learning & Pattern Recognition),"[Uday Kamath,Kenneth Graham et al.]",54.95,257,3.9,8,6.1 x 0.7 x 9.2 inches,12.2 ounces,English
Predictive Analytics: Data Mining Machine Learning and Data Science for Practitioners (Pearson Business Analytics Series),[Dursun Delen],47.49,350,4.1,12,5.95 x 1.1 x 8.9 inches,1.48 pounds,English
Pre-K-12 Guidelines for Assessment and Instruction in Statistics Education II (GAISE II): A Framework for Statistics and Data Science Education,"[Anna Bargagliotti,Christine Franklin et al.]",15,122,5,4,8.5 x 0.28 x 11 inches,10.7 ounces,English
Confident Data Skills: How to Work with Data and Futureproof Your Career (Confident Series),,14.64,320,4.7,15,5.51 x 0.79 x 8.46 inches,14.1 ounces,English
Learning Tableau 2022,"[Joshua N. Milligan,Blair Hutchinson et al.]",55.09,566,5,14,7.5 x 1.28 x 9.25 inches,2.12 pounds,English
The Data Warehouse Toolkit: The Definitive Guide to Dimensional Modeling 3rd Edition,,40.16,600,4.7,531,7.38 x 1.36 x 9.25 inches,2.14 pounds,English
Data Science in Education Using R,"[Ryan A. Estrellado,Jesse Mostipak et al.]",48.95,284,4.6,15,6.85 x 0.72 x 9.69 inches,1.31 pounds,English
Data Mining with Rattle and R: The Art of Excavating Data for Knowledge Discovery (Use R!),,84.99,394,4.3,53,6.1 x 0.93 x 9.25 inches,1.48 pounds,English
Statistics for Beginners in Data Science: Theory and Applications of Essential Statistics Concepts using Python (Machine Learning & Data Science for Beginners),,17.99,188,4.3,22,6 x 0.43 x 9 inches,9.1 ounces,English
Detecting Regime Change in Computational Finance: Data Science Machine Learning and Algorithmic Trading,"[Jun Chen,Edward P K Tsang]",54.95,138,,0,6.14 x 0.35 x 9.21 inches,10.6 ounces,English
Massive Graph Analytics (Chapman & Hall/CRC Data Science Series),,150,590,,0,7 x 1.5 x 10 inches,2.86 pounds,English
Practical Data Science with R,"[Nina Zumel,John Mount]",35.74,483,4.5,36,7.38 x 1.2 x 9.25 inches,2.29 pounds,English
Neo4j Graph Data Science Certified: Exam Practice Tests,[Cristian Scutaru],14.99,118,4.5,2,6 x 0.27 x 9 inches,6.1 ounces,English
Grokking Machine Learning,[Luis Serrano],47.99,512,4.6,10,7.38 x 1.1 x 9.25 inches,1.9 pounds,English
Data Science for Immunologists,"[Niclas Thomas,Laura Pallett]",28.06,159,4.7,18,7 x 0.38 x 10 inches,12 ounces,English
Data Science Analytics and Machine Learning with R,"[Luiz Paulo Favero,Patricia Belfiore et al.]",150,924,,0,,1.11 pounds,English
